text,label
"Я побывал там в качестве делегата из Токио, чтобы принять участие в студенческой конференции, так много студентов там были дружелюбны и теплые, что мне действительно понравилось там, здания хорошо построены, и я хотел бы, чтобы я мог учиться там.",1
"Мы в колледже гастролируем с моим дедом в Гарварде, а также с другими членами семьи, которых мы хотели увидеть, а также показать нашим подросткам, что он может предложить, я чувствую, что это безопасная зона для них с большими надеждами, что они могут подать заявку.",1
"Обстановка у реки Чарльз помогает, как и солнце сегодня, но деньги, явно потраченные на восстановление вершин башен, окупаются, поскольку пейзаж, когда человек ездит по университету, привлекателен, как мистер Гарвард и его золотой ботинок, который должным образом коснулся.",0
"Мы забронировали тур по Хахварду, и это было очень познавательно и вдохновляюще для наших детей, чтобы почувствовать такое историческое место.",1
"Ни одна поездка в кембридж не будет завершена, пока вы не посетите площадь Гарварда, где вы можете парковаться на улице и войти в ворота без каких-либо хлопот, включая библиотеку и статую Джона Харвардса.",1
"Гарвард очень похож на то, что вы ожидаете от многих богатых парней, гуляющих по красивой архитектуре и знаменитым достопримечательностям, определенно стоит прогуляться с остальной частью туриста вокруг Харвард-сквер и некоторых зданий, которые открыты для публики, если ни за что другое, что сказать, что вы сделали это.",0
"Удивительный кампус, такая замечательная история и архитектура Джон Гарвард статуя обязательна и так много великих музеев",1
"Когда мы пошли на завтрак в отель Sheraton Commander, мы были поражены тем, насколько красивы университетские территории.

Некоторые из архитектур впечатляют, и территория действительно хороша, увидев только университеты в Сиднее и некоторые из региональных университетов Nsw дома, ни один из австралийских кампусов не сравнить с историей Гарварда.",0
"Это прекрасный кампус с интересной историей и имеет прекрасное классическое коллегиальное чувство к нему, поэтому его приятно делать, если вы находитесь в районе Бостона и хотите другую пару часов, лучшая часть - книжный магазин Гарварда рядом с удивительными находками там.

Ps кампус очень легко получить доступ через метро",0
"Мы с женой были в районе Бостона для игры в Redsox и решили остановиться в Гарварде и осмотреть его, казалось, что любой другой университетский городок в этом районе был более туристическим, чем в других районах, и казалось, что было гораздо больше людей, делающих то, что мы делали, оглядываясь вокруг Гарварда, чем я ожидал, рад, что мы сделали это.",0
"Я сделал платный тур по Гарварду, это место огромно, и я подумал, что было бы лучше, чтобы экскурсовод мой гид был Самантой, и она была просто великолепна, наша группа была довольно большой в тот день, но Сэм смог привлечь всех, и у нее был громкий голос, и никто не мог сказать, что они не могли услышать, что она говорила, что Гарвард настолько полон истории, действительно отличный тур, чтобы проверить, стоит ли 10, на мой взгляд.",1
"Было видно, что погода была холодной со снегом и льдом, но было действительно приятно видеть статуи зданий и парки.",1
"Мы отправились в Гарвард в метро, и экскурсионный стенд был прямо на станции Нико был нашим гидом, у него была отличная личность и он был хорошим четким оратором.
Здания Гарварда впечатляют и хорошо сохранились, было интересно узнать о студенческой жизни в Гарварде, и мы наслаждались историями и информацией о колледже.",1
"У меня было несколько часов, чтобы убить чаевые, поэтому я прыгнул на красную линию, пошел в Мит и Гарвард, в то время как у Мит была очень причудливая архитектура Гарвард просто невероятен, старые здания и вся архитектура взорвет ваш разум, я мог бы провести еще 23 часа, я мог бы опубликовать некоторые из 50 фотографий на Herei был взорван пойти сюда, или вы пожалеете об этом",1
"Гарвардный двор - это зеленый листовой внутренний двор, который превращает вас в другой мир безмятежным и вдали от шума суеты всего в нескольких шагах от него, чтобы увидеть естественную красоту кампуса колледжа, не забудьте натереть обувь Джона Харвардса на удачу и возможную помощь в процессе приема.",0
"Вы не можете сказать, что вы посетили Бостон и не прошли его легкий поход в метро и легкую прогулку до Гарварда во дворе его прекрасного кампуса, как только вы достаточно прогулялись до отеля Чарльза, использовали ванную комнату и пообедали или выпили.",0
"Гарвардский университет - это название, которое не нужно идентифицировать, вы будете приняты огромными удивительными кампусами и зданиями, в которых также есть несколько чрезвычайно зеленых дворов, где вы можете отдохнуть от долгой ходьбы.",1
"Прекрасный способ увидеть кампус и услышать немного об истории Гарварда - это отличная идея, чтобы студенты проводили экскурсию, случайные анекдоты просвещали его нелегко одновременно угодить родителям, которые покупают в колледже со своими подростками и туристами, которые просто хотят развлечься.",1
"Отличная пешеходная экскурсия по удивительному Гарварду с нашим фантастическим забавным знающим и харизматичным гидом Леленой, недавним выпускником, который восхищал нас историями и историей Гарварда, что удивительный опыт, чтобы быть в состоянии посетить Гарвард.
Территория и здания были полны истории и традиций, и Лелена рассказывала нам несколько историй о знаменитых прошлых студентах и самих зданиях, особенно об удивительной библиотеке, которую мы также посещали в некоторых студенческих кварталах и заканчивали в магазине в Гарварде, которым управляют студенты.
Этот тур имеет очень высокий рейтинг от нас за важность его истории и людей, которые посещали в прошлом, и для людей, которые могут присутствовать в будущем, и для нашего гида, который оживил его для нас с нашим кратким визитом.",1
"Мы были там за два дня до начала дня было много активности в кампусе и за пределами кампуса много выпускников гуляли в своей кепке и халате, фотографируя со своими семьями много волнения в воздухе.",1
"Гарвард, вероятно, мой любимый район в Бостоне много интересных архитектур, а не ваш типичный университетский городок, вероятно, больше причудливый университетский городок, так как я не верю, что многие из этих магазинов выживут в бедном университетском городке, мы также присоединились к туру, было забавно и приятно, что в музее естественной истроя есть много, чтобы увидеть, что мы обедали с едой, приготовленной фуд-каром.",1
"Это чистый дружественный сейф и имеет симпатичные магазины, есть много, чтобы увидеть, и это прямо с t",1
"Гарварда место у меня были некоторые ожидания о, возможно, это потому, что в Европе, но Гарвард территории просто не впечатлили меня, это не заботились хорошо, и это выглядело голым здания являются некоторые хорошие архитектуры, но для меня ничего особенного вы не позволили внутри зданий в июле и августе, поэтому план соответственно проверить его, если вы проходите мимо, но не сделать однодневную поездку, если это",0
"Даже если вы не можете попасть в Гарвард, вы можете почувствовать себя особенным, будучи частью толпы кембриджа.",1
"Если вы цените образование, отличное посещение такого количества истории, чтобы испытать это место, может занять целый день.",1
"Наш первокурсник-гид Ленцо действительно был потрясающим, мы были единственными людьми в его туре в тот день, который был бесплатным, но добровольное пожертвование приветствуется, но он не показал никаких признаков разочарования в том, что ему пришлось провести пару часов в компании пары пенсионеров, действительно он пошел из своего пути, чтобы привить свой энтузиазм к своему университету в нас, он сделал весь тур, идя назад, рассказывая нам о зданиях, на которые мы смотрели, у него было много анекдотов, чтобы поделиться, что сделало тур интересным и веселым, включая тот факт, что он жил в старом общежитии ts elliots, как круто, что он был в то время, когда он жил в старом общежитии.",1
"Это необходимо сделать, когда в бостонском туре студенты проводят его так информативно смешно, что вы действительно получаете отличное чувство для жизни колледжа в прошлом и настоящем.",0
"Мир ждет, когда ландшафтный урбанизм преобразует площадь в место для людей с обильными велосипедными стойками и сезонным пабом.",1
"Мы самостоятельно объехали территорию, это красивый кампус, наполненный историей, и мы чувствовали себя довольно приветствуемыми.",0
"Как ни странно, место, которое вы хотите посетить, когда вы отправляетесь в Бостон, некоторые бесплатные туры организованы вокруг кампуса, некоторые морниги, которые я сделал во время летнего визита, были лидерами завтрашнего дня.
Также не забудьте прикоснуться к подножию статуи, так как это приносит удачу.",1
"Я не люблю университеты с библиотеками, закрытыми для общественности знания должны быть открыты для каждой специально библиотеки я был студентом в университете Эдинбурга топ-20 университета в мире и его библиотека открыта для всех не поймите меня неправильно быть в Гарварде приятно, но, безусловно, говорит вам много, когда вы не можете даже взглянуть на его библиотеку, возможно, потому что некоторые выпускники станут частью оружейной промышленности, которая базируется в Бостоне.",1
"Я поехал в Гарвард с моим сыном, который преследует доктора философии в Харварде, кампус очень приятен и привлекателен для путешественников.",1
"Я посетил кампус и совершил 2-часовую пешеходную экскурсию, было легко добраться до поезда красной линии около 4 остановок от центра города, это заняло около 1015 минут, и поезд прибывает чуть ниже площади Гарварда.

Как туристическая достопримечательность, она не оправдала моих ожиданий, но мне все еще нравилось, что она была в Оксфорде и Кэмбридже, я, возможно, нереалистично ожидал чего-то грандиозного и живописного, но Гарвард не совсем то, что его очень функциональные большинство зданий находятся вне пределов, а садовые зоны - просто трава.

Я бы порекомендовал посетить, но предложил бы взять тур, как только вы доберетесь туда.",0
"Прогулка по саду Гарварда и всему кампусу похожа на прогулку по истории, если вы не знаете, на что вы смотрите, это может быть довольно скучным, лучший вариант - загрузить руководство по городу Бостона, доступное бесплатно от консультанта по поездкам, в качестве приложения на вашем смартфоне или iPhone, в руководстве есть руководство по саду Гарварда, которое объясняет каждое здание, на которое вы смотрите, с историей и интересными фактами, есть также приложение, называемое каждой тропой, которую вы можете загрузить, и у него есть руководства, а также gps, управляемые живыми картами, также бесплатно и компания консультанта по поездкам.",0
"Он не слишком переполнен по утрам в выходные дни, если вы начинаете около 89а, это не огромный кампус, поэтому вы можете охватить основные моменты примерно за час.",0
"Прогулка по двору Гарварда - это посещение художественных музеев Гарварда, кампус бизнес-школы Гарварда через реку Чарльз - восхитительная прогулка по пешеходному мосту недель.",1
"Помимо того, что бостон должен видеть двор, это прекрасный городской корпус, даже если он почти всегда занят пешеходным движением, прежде чем идти.",0
"Мы не провели официальный тур, но очень понравилось исследовать этот красивый кампус на нашей собственной осенней листве было прекрасно подобраны сувенирные футболки в кооперативе, который имел хороший выбор для всех возрастов.",1
"Это была первая остановка в туре, который привел нас в Лексингтон и Конкорд, сказав, что это, вероятно, будет выглядеть как отвратительное преступление для выпускников Гарварда, но я думаю, что вы действительно должны быть одним из них, чтобы по-настоящему возбудиться по этому поводу, но это действительно воплощает некоторую историю, поэтому, возможно, взглянуть на это нужно.",0
"Очевидно, это очень известный университет и бренд, и я заглянул сюда, чтобы быстро прогуляться, так как я был в окрестностях большого и красивого кампуса, я был здесь во время зимних каникул, поэтому было тихо.",0
"Университетский кампус показывает так много различных видов этого удивительного места, что здания так хорошо сохранились для эпохи, когда они были построены.",1
"Прекрасная тихая прогулка по территории, любуясь зданиями
Любой, кто посещает Бостон, должен сесть в метро и посетить Гарвард.",0
"Мы взяли один час бесплатной экскурсии по Гарварду, который взял нас через Гарвард двор тур предоставляет интересные факты и историческую информацию и позволяет вам зайти в некоторые из Гарвардов много красивых зданий, чтобы взять бесплатный тур пойти в Ричард и Сьюзан Ф-Смит университетский центр, расположенный на горе Оберн и Данстер-стрит",0
"Какой замечательный тур наш гид Элизабет был остроумным и информативным, она дала нам краткую историю Гарварда, объяснила пьесу на имя без rs и даже под дождем сумела развлечь нас тур был около 1 часа и даже сумела удержать внимание наших 16-летних внуков, она задала вопросы и ответила им, что отличный способ посетить Харвард Ид определенно рекомендовать тур много веселья.",1
"Город Гарвард и университетский комплекс - это однозначный визит, если вы находитесь в районе, где мы поймали 69 автобусов из Лехмера, которые шли прямо туда по улице Кэмбридж.

Я думаю, что это прекрасно в течение весны и лета, когда мы наслаждались поездкой, и шел холодный дождь.",1
"Это был мой первый взгляд на американскую лигу плюща около 10 лет назад, ее красивый кампус и, безусловно, имеет атмосферу престижа, но я не уверен, что все это зависит от того, что люди говорят, что с тех пор я посетил другие школы, такие как Стэнфорд, и я предпочитаю спокойную атмосферу стиля кантри-клуба, которую я испытал там, менее снобизм и более расслабленный.",0
"Да, это старый, но все еще просто университет, здесь больше истории, чем вы могли бы подумать, учитывая, сколько президентов и известных людей прошли по этой территории. Я настоятельно рекомендую студенческий тур, чтобы вы могли присоединиться к Гарвард-сквер самой удивительной частью для меня было то, что верхний этаж дома Massachusetts по-прежнему используется в качестве общежития для первокурсников, где студентам могут быть назначены те же комнаты общежития, используемые Джоном Адамсом и Джоном Хэнкоком.",0
