text,label
"Это одно из тех мест, где можно проверить, были ли списки, но дело в том, что кампус старый и имеет несколько хороших зданий в целом, хотя архитектура не так впечатляет, а ландшафтный дизайн в лучшем случае посредственный.

Те, кто посетил кампусы, такие как Ува Индиана или Уильям Мэри, не будут впечатлены.",0
"Экскурсия по кампусу с Эли этот парень был очень хорошо осведомлен, у него было много информативных лакомых кусочков информации, он был забавным остроумным, и его диалог был пронизан каламбурами, которые держали его всех пожилых зрителей внимательными.

Он сказал нам, что его концентратором была эволюционная биология человека, а его вторичным — драма, и я определенно буду искать его на шоссе в не слишком отдаленном будущем.

Я настоятельно рекомендую этот тур, и если вам удастся получить Эли, это будет бонусом.

Удачи в ваших будущих начинаниях",1
"Получил бесплатную экскурсию от одного из студентов, стоит потратить время, чтобы услышать историю университета.",0
"Рекомендуйте студенческие экскурсии, которые можно забронировать в киоске в главной зоне за воротами, это стоит денег, так как он включает в себя билеты в музей, а также чувствовать себя вдохновленным, когда вы блуждаете по площадям, забитым студентами, загруженными задними пачками, мчащимися к своей следующей позе класса рядом со статуей Гарварда, если вы потираете его палец, чистите руки и читаете, как студент замечает, что внешние общежития за пределами основного кампуса так же интересны, и посещение главного книжного магазина также должно быть интересно.",1
"Если вы турист в бостонском университете Гарварда, безусловно, стоит посетить, даже если это просто прогуляться по площади, чтобы взять историю в хорошем виде из центра Бостона, но легко добраться по т-линии или автобусу, мы были там, когда шел дождь, поэтому побежали для укрытия в церковь, это оказалось главным результатом, поскольку это было потрясающе и реальный пример бостонского исторического прошлого, нам вдвойне повезло, что у нас было все это для себя, а затем джентльмен начал играть на прекрасном органе, это было похоже на прекрасный оазис от погоды и движения.",0
"Я посетил университет Гарварда несколько раз в первый раз, потому что это было место для романа, которым я наслаждался с тех пор, он стал полурегулярным прибежищем, и я посетил несколько зданий, а также блуждал по зданиям кампуса, которые широко расположены, поэтому дождливый день не способствует приятному посещению, однако, если в кембридже это необходимо.",0
"Я не уверен, что я ожидал его переполнение с туристами, мы сделали комментарий о том, что плохо для студентов, кампус средний, и окружающий город был обычным, я рад, что мы пошли и добраться туда на t было легко, но в целом нет слишком много, я не вижу необходимости возвращаться в следующий раз, когда я в Бостоне.",0
"Провел прекрасный день, гуляя и проверяя некоторые здания, достойные посещения, и хотел бы вернуться.",1
"Мы были в этом районе и знали, что мы должны были остановиться в Гарварде, просто чтобы сказать, что мы были там, это была довольно простая парковка, но мы поехали прямо утром, мы прошлись по двору Гарварда, что довольно впечатляюще, чтобы увидеть, что мы не заходили ни в какие здания, но мы сделали несколько фотографий и погуляли вокруг, и рекомендовали остановиться, если вы находитесь в этом районе, и у нас есть некоторое время, чтобы посмотреть карту кампуса на вашем мобильном телефоне, чтобы помочь с вождением в этом районе и ходьба вокруг него помогла много.",1
"Красивая архитектура умных детей даже собаки выше среднего, много хороших покупок и доступной еды можно найти поблизости.",1
"действительно приятное место, чтобы посетить так много, чтобы увидеть красивые старые здания прекрасные территории и большие необычные магазины, особенно табачный магазин Leavitt peirce напротив кассы библиотеки Гарварда Джордж Вашингтон Вязовое дерево и африканская американская похоронная площадка была так много бездомных",1
одно слово удивительный просто великолепный опыт красивый кампус Welcomi g,1
"Здесь так много истории, что отправляйтесь в официальную экскурсию по Гарварду, проведите некоторое время во дворе Гарварда и возьмите все это в одной из самых знаменитых американских традиций.",1
"Вау, я понял, что, как глупый вопрос, вы не знаете Гарварда университетского человека, он хорошо ценится во всем мире в течение последних 400 лет.",1
"Это, вероятно, один из самых красивых кампусов колледжа, которые я когда-либо видел, вокруг исторических старых зданий много зелени, все очень близко друг к другу, и есть карты, которые трудно потерять, и вы можете увидеть большую часть кампуса за несколько часов.",1
"Если есть место, где вы можете исследовать и узнать об истории Соединенных Штатов, это должен быть университет Гарварда, поскольку он почти так же стар, как сама страна, и полон историй великих людей, которые заложили краеугольные камни страны и продолжают делать ее превосходной.",1
"Как только вы входите в университетскую область, вы чувствуете, что становитесь моложе и энергичнее, особенно с самыми умными студентами вокруг вас.",1
"Вы должны пойти и прогуляться по двору Гарварда, это короткая поездка на т, и когда вы выходите из остановки, вы там, поэтому это легко, и что-то, что вы должны сделать, есть также несколько отличных мест вокруг.",0
"Я был в Гарварде пару раз, и каждый раз, когда я иду туда, действительно не так много, чтобы увидеть или сделать да, это круто, чтобы быть на территории университета Гарварда, но помимо прогулки по большой открытой травянистой местности, не так много идти, чтобы увидеть Джона Харварда и сфотографировать, касаясь его ноги.",0
"Во время посещения университета наш гид по имени Александр проводил свой первый тур, он дал нам много информации, был рад ответить на вопросы и предложил около десяти минут в течение запланированного часа, в день визита было много туристов, но другие просто прогуливались в качестве студента, я мог негодовать на такое вторжение, но в день, когда я был рад возможности увидеть для себя всемирно известный кампус, я рекомендую бронировать через официальный сайт университета.",0
"Моя дочь теперь является выпускником этого университета это опыт, который не может быть сопоставлен с моей дочерью немного грустно, чтобы оставить своих друзей в качестве старшего потрясающий вид из своей комнаты.
380 лет академической истории лежали в этом учреждении я взял немного в но не достаточно есть музеи изобилия и искусства и публичных лекций
Пусть ваша семья найдет что-то, что понравится каждому из них.
спортивная парусная научная музыка играет спектакли различных типов",1
"Очень приятный квартал кампуса, мы посмотрели на различные здания и исторические в кампусе Гарварда много туров, но не мешало услышать о жизни в кампусе и о том, как все началось.
",1
"Мы отправились в бесплатный студенческий тур в будний день утром с группой из около 30 человек, студенческий гид был дружелюбным и информативным и ответил на гостевые вопросы, она оживила историю зданий и включила некоторые из ее личных переживаний, когда она говорила о своем главном общежитии, в котором она жила и т. Д.",1
"Самый старый университет в Америке и один из лучших в Гарварде представляет все, что кампус огромный и очень чистый, его удивительно ходить и фотографировать вокруг кампуса есть десятки мест, чтобы посетить рестораны кафе и т. Д.
В тот день, когда я приехал туда, было очень холодно, 12 градусов Цельсия, так что я не мог остаться столько, сколько хотел, но я уже планирую вернуться.",1
"Кампус красив, особенно в осенний сезон, и архитектура классическая, это была идеальная обстановка для обеда на пикнике.",0
"Я работаю здесь, поэтому мне повезло провести много времени, прогуливаясь по двору, когда погода хорошая, вы можете сидеть в красочных стульях на газоне, он открыт для публики, и туры доступны.",1
"Это немного далеко от центра Бостона, но было интересно увидеть один из самых известных университетов в мире.",1
"Мы решили посетить университет Гарварда, рады, что мы взяли красную линию метро от нашего отеля, мы остановились в секции маякового холма была приятная 10-минутная поездка на вокзал Гарварда, когда вы выходите из железнодорожного вокзала справа от вас - это экскурсия на 10, предоставленная студентами Гарварда, туры начинаются в 1030 пробежать до 330 каждые полчаса наш гид Франкеска был очень информативным, взаимодействовал с группой и имел много информации, чтобы поделиться экскурсией длится около часа проводится за пределами области вокруг Гарварда было много торговых ресторанов, а также",1
"Было немного сложно найти парней, чтобы сделать тур специально, потому что мне сказали пойти другим путем, когда я вышел из метро.
Но после того, как они нашли их, они были очень дружелюбны и объяснили много любопытства зданий.
Сам университет очень красивый и хорошее место для прогулок.",1
"Было волнительно думать, что я иду по стопам многих известных людей, это было также спокойно и чрезвычайно приятно для глаз.",0
"Я пытался получить платный тур через Tripadvisor, но у меня были проблемы с моей машиной, я решил проверить веб-сайт hbs, и были разные туры для бизнес-школы, я был взволнован после этой сессии, я думал, что я действительно могу посещать hbs, возможно, класс 20202021.",1
"Это красивый кампус в течение лета, но из-за шумихи вокруг него я обнаружил, что слишком много ожиданий и поэтому был немного разочарован, я видел другие американские университетские кампусы, которые намного красивее и интереснее.",0
"Он отправился в студенческую экскурсию и был действительно хорошим способом провести полтора часа в истории, и здания прекрасно видны вблизи.",0
"Есть прекрасные виды и свежий воздух дружелюбные люди всегда говорят привет к нам сильная атмосфера обучения заставила меня чувствовать себя комфортно я люблю этот университет, когда я увидел этот университет я сделал мечту я буду учиться в этом университете, хотя я знаю, что это так удивительно, я постараюсь сделать все возможное, чтобы достичь моей мечты.",1
"Если честно, если бы университет не был Гарвардом, я бы не побывал там, но история и истории привлекают больше посетителей.",0
"Я бы очень порекомендовала поездку в Гарвард, это было так красиво, и просто мир, отличный от центра города, невероятно увидеть это место по-настоящему, увидев его во многих фильмах, выпить кофе и побродить, насладиться шумом.",1
"Нам так повезло, когда мы приехали, они были в центре изменения климата.
Протест был упорядоченным и имел прекрасных певцов-барабанщиков и впечатляющих ораторов.
Я не мог бы спланировать это лучше",1
"Гарвардский университет и его окрестности представляют собой вершину меритократии в образовании, его непревзойденная репутация и буквальное взаимодействие в городском платье создают эфирную одухотворенность свободы мысли, которую как древние греки, так и наши отцы-основатели представляли в качестве выпускника каждый раз, когда я возвращаюсь в кампус, я отнимаю милое желание использовать возможности, которые предоставляют мне отношения Гарварда, и быть лучшим гражданином общества в результате этого.
Я люблю делиться своим опытом буквально с друзьями, которые я сделал на прошлой неделе по текстам, которые я получил после этого.",1
"Настолько весело, что наш гид был потрясающим, что я любил ее, ее истории и личность, что я просто хотел бы, чтобы мы могли видеть внутри некоторых зданий, особенно библиотеки.",0
"Мы гастролировали по университетам, и Гарвард был обязательно должен увидеть в списке его в самом сердце кембриджа и чувствует себя как маленький город в городе его именно то, что вы ожидаете, но гораздо больше, чем вы случайно прогуливаетесь по территории, его расслабляющий убедитесь, чтобы потереть ногу на статуе его на удачу попросите студента, они могут объяснить историю лучше, чем быстрый обзор, пока вы в нем получите футболку, чтобы забрать домой.",1
"Поскольку мы уже находимся в Бостоне, мы решили увидеть университетский городок Гарварда, где нечего делать, кроме как объехать кампус, посмотреть на здания, сделанные на статуе Джона Харварда.",0
"Я ходил по университету Гарварда в ноябре 2021 года около часа, я видел Гарвард во дворе мемориальной церкви Джон Харвард, мемориальный зал университетской библиотеки Гарварда и зал Массачусеттса, это было очень приятное место, чтобы прогуляться, особенно в воскресенье утром.",1
"Во дворе живут туристы и природа в течение всех сезонов летом и осенью много людей и мероприятий для семейного веселья и приятного для романтических прогулок зимой и весной вы получаете отличные фотографии природы, и если вы из Бостона, вы можете быть взволнованы тем, что находитесь внутри двора Гарварда с его богатой историей и статуей Джона Харварда.",0
"Студенческие туры были отменены в тот день, скорее всего, из-за жары, но мы все еще ездили и гуляли в определенных местах, чтобы получить хорошие фотографии очень впечатляющих зданий, которые стоит посетить.",1
"Гарвард является обязательным, если вы находитесь в районе Бостона, но посетите с экскурсоводом, они скажут вам, что гораздо больше зданий не имеют чувства агры и истории, которые вы получаете, если вы видите Оксфорд, но экскурсовод может рассказать вам так много о более широком зале области, в частности, было здорово.",0
"У нас была конкретная цель для нашей поездки в район Бостона, которая не включала посещение каких-либо учебных мест, таких как Гарвард, но наш гид настаивал, чтобы мы остановились в мемориальном зале Харвардса, чтобы увидеть мемориальный трансепт из-за моего интереса к гражданской войне.

Нам так повезло, что мы последовали его совету, что мы были только с теми в комнате, все, что мы можем сказать, это было потрясающе, витражи прекрасны, если вы там не пропустите это.",1
"Во дворе всегда есть, что посмотреть, даже если это просто здания, конфигурация и деревья, но посетители прекрасно видят, что экскурсии весело слушать, а смесь студентов факультета, родителей и местных жителей, очень весело рисовать фауст, чтобы люди просто приходили и читали, ели или разговаривали во дворе, мемориальная церковь и более широкая библиотека сталкиваются друг с другом и действительно впечатляющие идут во время выпуска и видят магию людей, которые так много работали, и их родители.",1
"Один из самых впечатляющих университетов, который я когда-либо видел, - это 34 часа и просто прогулка по зданиям библиотек и садов.",1
