text,label
"Мы завершили потрясающий тур по Харвардскому университету Ханна, студент в университете был нашим гидом и объяснил историю этого места и ответил на все вопросы с большим расширением некоторые фантастические исторические здания по всей территории хорошо, чтобы увидеть, где был создан Facebook, если вы делаете тур по бостонской утке нет дополнительной платы за тур.
Легко добраться до метро и стоит поездки, если у вас есть время, чтобы сэкономить в Бостоне.",0
"Я любил иллюстрации и дисплеи съедобной флоры от какао-бобов до ванильных деревьев, а также моллюсков и других морских деликатесов.",1
"Некоторые части кампуса находятся под реко в данный момент предлагают вечернее посещение, когда толпа низкая.",1
"Они по-прежнему позволят вам ходить по кампусу бесплатно, туристические группы немного мешают, но задерживаются вокруг них, и вы можете выбрать интересный лакомый кусочек или два, конечно, если вы не платите за тур, вы не должны злоупотреблять этим трюком, но вы знаете, что это похоже на посещение вечеринки в колледже, вы можете не курить травку, но вы все равно в конечном итоге получите высоко, так что со всеми турами, проходящими вокруг кампуса, если вы идете в тур, и вы, вероятно, должны обязательно спросить своего гида о буксире с пушкой и российским траулером.",1
"Кампус прекрасен и неожидан, красивые здания отправляются городом вокруг них.",0
"Прекрасная остановка при посещении исторических зданий в районе Бостона изобилует красивым кампусом и множеством достопримечательностей, которые можно увидеть здесь бесплатно",1
"Если бы вы могли через осмос получить знания, мой мозг взорвался бы
Делайте много фотографий, отнимайте время",1
"В любое время года вы можете исследовать священные залы первого университета Америки, посетить различные музеи и побродить по истории в знаках статуй и названиях зданий.",1
"Прекрасный кампус с прекрасной архитектурой и прекрасными садами отличное место, чтобы прогуляться, проверить некоторые продовольственные грузовики и посетить некоторые исторические залы, а также прогуляться по массовой авеню для некоторых замечательных достопримечательностей и изысков.",1
"Это может занять немного работы, чтобы связаться с экскурсией, чтобы проверить гарвардский двор, но стоит усилий спросить студента или двух о традиции трения Джон Харвардс ботинок его гарварды не так хорошо держать в секрете.",0
"Отличное место для прогулок по сторонам

Огромное количество туристов и туристических групп делают то же самое, что и образовательный Диснейленд.

",1
"Прогулялся по юридическому кампусу и его простым красивым зеленым газонам и красивым зданиям, очень историческим и престижным, его прекрасный район для прогулок",1
"Гарвард является не только одним из старейших, но и лучшим университетом в мире, поэтому каждый студент должен увидеть его, если они посещают кембридж, Гарвардный двор представляет историческую и традиционную сторону Гарварда, в то время как кампус позади является центром знаний и исследований, многие библиотеки с различными названиями и функциями расположены во дворе и кампусе.",1
"Очень красивый кампус, мы иногда спускаемся по реке Чарльз, мои выпускники-хабби, в мае я буду скучать",1
"Мой сын-подросток любил это, возможно, из-за восторженного гида, это было познавательное веселье, интересное и отличный способ прогуляться по Гарварду, не тратьте время на прогулку по собственному городу и будьте щедры с советами.",1
"Двор на самом деле является домом для большинства гарвардских первокурсников, которые отдыхают под тенистыми деревьями или присоединяются к бесплатной пешеходной экскурсии, отправляясь в информационный центр в центре холойоке, чтобы действительно узнать об истории людей.",1
"Великая история того места, где это заставило многих людей изменить мир, моя лучшая часть - ходить по улицам поблизости.",0
"Гарвардный двор всегда прекрасен, но за неделю до окончания школы он украшен алыми и золотыми знаменами, что делает его еще более красивым, и великие валуны, установленные на тротуаре перед научным центром, хорошо сидят.",1
"Много, чтобы увидеть, мы посетили выставку jfk, что большой опыт площадь Гарварда полна истории есть много ресторанов и магазинов рядом легко добраться до красной линии t",1
"Гарвард-сквер - хорошее место, чтобы прогуляться и увидеть достопримечательности и сделать несколько фотографий, особенно селфи с гарвардским ростом.",0
"Я надеюсь, что история и престиж пребывания в окружающей среде вдохновляет моих дочерей-подростков на отличные места, чтобы поесть на площади Гарварда и в нескольких выдающихся музеях по всему кампусу.",1
"Мы бродили по Гарварду без экскурсовода, и, честно говоря, это был все еще очень приятный опыт, университет абсолютно потрясающий, и было действительно здорово посетить такое знаковое место.
Мне особенно понравилось посещение во время падения, потому что падающие листья просто придали зданию более причудливый вид.
Обязательно посетите, если вы находитесь в этом районе.",1
"Красивое и пахнет историей, что место просто бродить вокруг и принимать в атмосфере потрясающе",1
"Мы решили взять наших подростков, чтобы увидеть Гарвард, это определенно не разочаровало его красивый кампус с ландшафтным дизайном и историческими кирпичными зданиями, а также отличный магазин одежды в кампусе, а некоторые магазины просто действительно большой район.",1
"Экскурсия по всему кампусу красивых зданий и площадей полюбилась музею естествознания и плексигласовому улью, что посмотреть",0
"Интересное место для прогулок и изучения выглядит так, как будто в фильмах есть хорошие места и очень оживленная местность по выходным вечером.",1
"Еще много талантливых людей описали это, прежде чем я прочитала им, библиотека Купа предлагает много книг в Гарварде.

Вы можете совершить экскурсию под руководством студентов

Лучший опыт - не посетить его, а учиться там.",1
"Мы взяли наших детей школьного возраста в Гарвард и mit для информационных сессий и экскурсий все в один день mit был хорош, но harvard был превосходен, информационная сессия была проницательной во главе с консультантом по приему и 2 нынешних студентов, которые дали свое мнение, ответили на вопросы и имели связь с консультантом, который сделал его привлекательным, это было далеко от душной атмосферы, которую мы ожидали, что был сделан акцент на всех, чтобы получить ощущение, что была семейная атмосфера в Гарварде, видео презентация в начале развлекала студенческий тур, хотя была несколько разочаровывающей, и хотя мы знаем, что некоторые из этого может быть из-за личности и знаний студента, ведущего его, мы никогда не заходили в какие-либо здания, общежития библиотеки классных комнат или любые другие, в то время как в Mit это было более захватывающим, и мы чувствовали, что мы знали, что жизнь будет чувствовать себя там нашими собственными глазами не только то, что было сказано нам.",0
"Если вы идете сюда, убедитесь, что вы сначала проводите какое-то исследование, так как очень мало информации вокруг самого двора Гарварда спускается к точке туристической информации и попадаете на экскурсию, чтобы получить лучшее от вашего визита.",0
"У нас был очень пышный гид, который просто любил школу, узнал историю школы и был взволнован, чтобы поделиться ею с группой, мой сын, которому всего 13 лет, был вдохновлен желанием пойти туда после того, как услышал эту девушку.",1
"Посещение гарвардской бизнес-школы во время моего визита в Бостон было похоже на детскую мечту, я провел 4 часа в этом месте, а также посетил класс мба в качестве посетителя, как образование обеспечивается, как студенты взаимодействуют, и объекты в классе действительно уникальны и современны, особенно дом тата, который заставил меня гордиться как индиец.",1
"Будьте осторожны, что есть другие платные туры с билетами, доступными в центре для обычных посетителей Бостона, и как только вы выходите из метро, что тоже может быть здорово, но есть бесплатная экскурсия через информационный центр Гарварда, бесплатные билеты доступны только в офисе за час до того, как только один человек в вашей партии должен забрать их.

Строительство находится в стадии строительства, поэтому дайте себе дополнительное время, чтобы найти правильную дверь, и офис очень переполнен, когда отправляется экскурсия, потому что людям негде ждать.

Много хороших лакомых кусочков и единственное разочарование было то, что публика не может пойти во многие здания, и наш тур не был во главе с студентом Гарварда.",0
"Сделайте шаг назад во времени и наслаждайтесь прогулкой по усаженному деревьями четырехугольнику, окруженному красивыми зданиями периода, уровень шума от города снаружи стихает, и вы можете сидеть и наслаждаться архитектурой и красотой университета.",1
"первокурсники остаются в общежитиях 18-го века, которые выстраиваются в ряды комнат Яд, где жили Кеннеди и Фредди, могут быть указаны более информированными людьми, чем я был там, когда говорил jfk, это был захватывающий момент в моей жизни.",1
"Даниэль Бергерджонс посетил гида по местной истории в качестве нашего гида, какой вклад он внес в наше понимание места, где он имеет увлекательную историю, но мало что очевидно для случайного посетителя, но с гидом он оживает.",0
"Посещение Гарварда — это то, что вам нужно сделать, если вы приедете в Бостон, хотя это одно из самых посещаемых мест в Ма, чтобы пойти туда, пересечь красную линию от Бостона до Алеуи и выйти на остановке Гарвард-сквер.",0
"Посетил здесь через один из студентов ведущих пешеходных экскурсий действительно понравилось узнать об истории колледжа.

Рекомендую разрешить 90 минут",1
"Американцы очень гордятся Гарвардским университетом, у них есть здания, датируемые 1800-ми годами, и много достижений и исследований было сделано там, Харвард необычен в США, поскольку я понимаю здания из красного кирпича, выложенные в судах и квадрах, и серьезные люди, блуждающие вокруг, думая о серьезных вещах.
К сожалению, я родом из Великобритании, которая имеет как кембриджские, так и Оксфордские университеты со зданиями, датируемыми 1400-ми годами и старше, и все это место просто пахнет историей, если это то, что вы ищете.
Я понимаю, что я мог бы взять тур, но тур, который был толкнул довольно сильно вокруг Гарварда, был неудивительно, что альтернативный и неофициальный студенческий тур, где вы платите студенту, чтобы рассказать вам об их дурацком студенческом образе жизни, который я не очень хотел.

Я действительно не могу придумать много, чтобы рекомендовать об университете Гарварда, как название говорит, если вы пришли из Великобритании и были или жили в Кэмбридже или Оксфорде или посетили их Харвард чувствует себя очень похоже на плохие отношения, но если вы никогда не были ни к одному из них вы могли бы найти это немного более интересно.",0
"Стоит посетить особенно двор Хахвад, который имеет некоторые из старейших зданий, включая общежития административных зданий, классы мемориальной церкви и более широкую библиотеку, университет имеет ряд отличных музеев, открытых для публики.",0
"Легко добраться на север по красной линии метро было бы неплохо прогуляться в ясный день, когда шел дождь, когда мы посетили так не слишком удобно, что мы нашли наш путь к офису кампуса Смита, чтобы присоединиться к бесплатному студенческому туру, но нам посоветовали подождать еще 25 часов, поэтому мы решили не убивать время под дождем больше вещей, чтобы увидеть в Бостоне.",0
"Это место, которое стоит посетить для истории и престижа, если вы уже находитесь в этом районе, не обязательно видеть, если вы планируете путешествовать специально для него, мы отправились на экскурсию для студентов, которую я бы предложил сделать для хорошего понимания, если вы пропустите время, тогда есть приложения и аудиогиды, которые вы можете загрузить один небольшой недостаток заключается в том, что вы не можете посетить внутреннюю часть зданий или увидеть какие-либо лекции, продолжающиеся, понятные для разрушения, которое это вызовет у студентов.",0
"Мы были здесь в субботу вместе с половиной Бостона.

Было приятно удивляться, что вокруг зданий было много тени от старых деревьев, поэтому было приятно и прохладно.

Большинство зданий университета закрыты для публики.",0
"ради того, чтобы сказать, что я был там, вы можете посетить это место, что ни одно из зданий не имеет какого-либо вау-фактора или какого-либо очарования, вам потребуется экскурсия с гидом, иначе это будет скучно.",0
"Они предлагают бесплатные туры примерно каждый час в кузнечном центре нет необходимости платить за студенческие туры на новостном стенде или наш гид помог объяснить нам Гарвард, и мы гуляли около часа, мы наслаждались этим.",0
"Мы провели велотур по кембриджу, который привел нас в университетский городок Гарварда с его очень красивой историей, если у вас нет времени, чтобы сделать тур с кем-то, кто может дать вам несколько фактов о нем, попробуйте зайти самостоятельно.",0
"Посещение этого места является обязательной обязанностью, когда вы находитесь в Бостоне, чувствуете здесь климатологию и американскую традицию.",1
"Есть студенческие экскурсии бесплатно из кампуса это дает вам фон, что ходьба по кампусу не даст вам истории о том, как первокурсник выбран для своего дома для старших классов, и что произошло утром после того, как библиотека сгорела, когда вы выходите из метро есть информационная кабина, которая укажет вам, где бесплатные туры они также продают отличную карту за 25 центов книжный магазин кооператив является хорошим местом, чтобы купить сувенир, а burdick - это шоколадный магазин прямо в Гарварде дорогой, но приятно, что вы можете прогуляться по улице рядом и совершить экскурсию по дому длинных друзей это удивительный тур и стоит 15 минут ходьбы от кампуса",1
"После всех лет его все еще впечатляет, чтобы посетить кампус, двор все еще интересно бродить, и были некоторые новые дополнения, которые были интересны, чтобы увидеть, не думали, что есть земля, чтобы построить что-то на, но я думаю, что они постоянно модернизируются.",0
"Ни одна поездка в Бостон не была бы полной без прогулки по этому историческому месту, которое закончили восемь американских президентов.",0
"Я бы порекомендовал взять гарвардский тур, тур дается высшим классом, и история Гарварда действительно интересна.",1
