text,label
"Было хорошо пойти и осмотреть этот знаменитый кампус множество достопримечательностей, а музей естественной истории был интересен, близлежащие магазины тоже довольно хороши, поэтому стоит отправиться в Хаххвард.",0
"На самом деле не место, чтобы взять подростков, книжный магазин был отличным, но район, в то время как архитектурно хорошо, не представляет интереса для мальчиков-подростков, магазины одежды были бы, если бы вы остановились в Бостоне, я бы использовал ваше время там.",0
"Совершите экскурсию, но даже если вы не хотите этого делать, вы должны посетить это место, самый престижный известный старейший самый богатый университет в мире 6 президентов США Билл Гейтс Марк Цукерберг и т. Д. Красивые территории приятные и полезные студенты красивая архитектура большинство из них в любом случае сказочные истории история история",1
"Если вам скучно и вы хотите, чтобы вам стало скучнее, то это подходящее место для посещения.
Я был удивлен, как плохо они приветствуют гостей в этом месте, потому что я ожидал центр посетителей, когда я прибыл, но вместо этого они бродят по району, как безголовые цыплята.",0
"Это отличный опыт, чтобы прогуляться и впитать историческую архитектуру и академическую культуру места, где я провел день и вечер, просто гуляя, наслаждаясь достопримечательностями и наблюдая за людьми.",0
"Навестил друга на проезжей части в Кэмбридже короткой прогулкой по проезжей части мимо изысканных старых новых английских колониальных домов, каждый из которых больше и более уникален, чем последний, если это возможно, чтобы добраться до самого Гарварда, наконец, нашел время, чтобы побродить по кампусу с его деревьями и уникальными зданиями, что удовольствие",1
"Один из самых выдающихся университетов в мире не только США в хорошем районе и хорошо поддерживается, как вы ожидаете, взять тур с одним из студентов и слушать все истории исторические и достижения выпускников вы не можете помочь, но быть впечатлены.",1
увидеть новый музей тумана и бушрайзинга в отреставрированном художественном музее Гарварда амбициозный и запоминающийся новый проект renzo piano удивительного немецкого искусства в буш-комнатах,1
"Мы совершили экскурсию по университету и были приятно удивлены его предложениями о зелени и зданиях были архитектурно красивыми, мы были удивлены тем, как мало студентов, которых он вмещает, мы были приятно удивлены изменениями в их финансовой помощи с 2004 года.",1
"Потратив час своего времени, чтобы получить внутренние знания этого исторического университета, стоит того, чтобы студенческий гид был очень смешным и веселым.",0
"Я не учился в Гарварде, но получил возможность посетить кампус, его кампус грандиозный и красивый с деревьями вокруг прогулки вдоль реки за пределами кампуса так очаровательно на закате времени площадь Гарварда полна студентов есть много сувенирных магазинов и закусочных за пределами кампуса его отличный университет и должен быть замечен.",1
"Я действительно ожидал, что лучшая еда будет во множестве ресторанов, и это был средний материал, который они подают вам в ресторанах с умеренной ценой, где место было приятно внутри, и что сделало опыт прохладным, так это то, что я был с друзьями, иначе еда не стоила той цены, которую я согласен с другим рецензентом, что холм, несколько дверей вниз, выглядит шатко, но лучше дегустировать еду.",0
"Гарвард-сквер обязательно нужно увидеть, когда в Камбридже университет является старейшим в наших странах и, возможно, лучшим в мире, он, безусловно, получил самый большой фонд, это было угощением для экскурсионного кампуса с моим сыном, любой потенциальный студент должен посетить статую Джона Гарварда, не пропустите библиотеку и столовую.",1
"Потому что это такое знаменитое место, мы были рады возможности пойти в кампус и кратко осмотреть территорию.",0
"Нет лучшего способа увидеть Гарвард, чем глазами студента, экскурсия была очень информативной, гид новый ее материал стоит во время поездки.",1
"Это очень круто знать Гарвард, потому что это очень известный университет он имеет много исторических зданий и сооружений, кроме того, что это просто школа.",1
"круто бродить по университету, но через некоторое время это выглядит как большинство университетских кампусов

Это большой кампус, поэтому мы рекомендуем вам сначала решить, что вы хотите увидеть, а затем отправиться туда.",0
"Мы совершили самостоятельную пешеходную экскурсию по Гарварду, и было здорово, что здания были действительно потрясающими в красном кирпиче Гарварда, и было здорово узнать немного об истории, когда мы были там, и было много туристов, удачливых, получивших фотографии без туристов.",0
"Мы пошли на это с более высокими ожиданиями, мы, безусловно, посетили более красивые кампусы.

С таким большим количеством дел в районе Бостона вы можете пропустить это.",0
"Есть много, если история в этом месте и здания великолепны, мне особенно понравилась часовня.",1
"Мы видели Гарвард во время неофициального тура, и это было слишком очевидно, чтобы увидеть и много истории, и стоит полдня объезда от Бостона.",0
"Это красивое и расслабляющее место, где мы наслаждались прогулкой по двору и осмотром красивых кирпичных зданий с уникальными железными работами, это отличное место, чтобы отдохнуть от оживленных улиц и людей на внешней стороне входа здесь.",1
"У меня был лучший образовательный и социальный опыт, когда я учился в Гарварде, я был оспорен и вдохновлен, получая лучшее образование и обучение, это просто лучший университет в мире, и я смирился, что учился там.",1
"Если посещение Бостона обязательно оставит место для красивого кампуса Гарварда, мы записались на экскурсию под руководством одного из студентов, и было действительно прекрасно, что было увлекательно узнать об истории Гарварда и увидеть жизнь в кампусе, мечтая о том, как было бы достаточно удачливо учиться в таком замечательном учебном заведении, книжный магазин Гарварда также является золотым рудником. время для этого, но избегайте моей ошибки, я был заперт там в течение двух часов.",1
"Я подозреваю, что некоторые из них будут поставлены, но, пожалуйста, не будьте, если ваш посещающий бостон сделает день из этого музея искусств потрясающим, вы можете часами просматривать некоторые бесценные экспонаты.

Еда в музее была прекрасна, как и персонал.

Центр также превосходен, как и книжный магазин Гарварда.",1
"Мы поехали в Кэмбридж и решили поехать в Гарвард.

Кампус, очевидно, довольно хорош и, безусловно, стоит ходить вокруг

Есть студенты за пределами кампуса рядом с кооперативом, которые дадут вам экскурсии по дешевке, мы просто прошли его сами, вы не можете зайти в различные здания по очевидным причинам.",0
"Ходил на экскурсию по кампусу под руководством студента, он был переполнен и варенье из-за выпускного дня хахвахд произносить без r это был приятный день, и погода хорошая, самые дорогие куски земли рядом с входной дверью, и это похоже на небольшой запрос экскурсовода для точного местоположения посетить сувенирный магазин, где он управлялся студентом, где он продает хахвахд футболка колпаки стекло и другие сувенир",0
"Нам потребовалось около 20 минут, чтобы сделать несколько фотографий, а затем пришло время двигаться дальше, если вы видели это место в фильмах, если нет, то не так много.",0
"Приятно видеть студентов и всех прогуливающихся по историческому двору прекрасным местом, чтобы сидеть и смотреть на солнце в течение часа.",1
"Поездка через метро в Гарвард на красной линии, безусловно, стоит посетить этот университет, начиная с 1636 года, часовая экскурсия по университетской площади и ряду других зданий проводится нынешними студентами, нашим гидом был Эли, который был просто отличным прикосновением театра, и 2-летний опыт работы в качестве студента дал нам представление об истории университетов и текущей жизни в качестве студента.",1
"Конечно, в Гарварде много истории, и нынешние студенты проводят экскурсию, которая является идеальным способом увидеть кампус, есть интригующие истории, чтобы услышать о настоящем основателе университета и о знаменитой статуе, гиды очень эффективны и хорошо информированы о близлежащих косяках.",0
"Мы были очень рады видеть Гарварда во время нашего визита в Бостон, мы прошли по фену, где мы остановились вдоль спортивного кампуса и пересекли мост к кампусу, единственное, что мы ожидали увидеть, было больше вывесок, которые указывали, что было, где и где мы были немного разочарованы, чтобы увидеть, как скрытые вещи, если бы у нас было больше времени, мы бы совершили экскурсию, сама земля была прекрасна, но не была полностью впечатлена всем, что музеи были лучшей частью.",0
"Работая в типографии, мне было интересно, что университет был закрыт, и не было никаких экскурсий, но нам разрешили посмотреть некоторые работы, которые были сделаны там.
Мы нашли его довольно интересным",0
"Каждый год мы ведем группу подростков в Гарвард, очень познавательный и вдохновляющий просто ходить по кампусу.",1
"Мы провели веселую экскурсию по кампусу, которая заняла около часа, было интересно услышать об истории этого места, и экскурсовод по студенческой жизни был второкурсником.",1
"Я был в городе на конференции, проводимой в Гарвардской школе права, это был мой первый раз там и заставил меня хотеть вернуться с большим количеством времени, чтобы сэкономить Гарвард так же красив, как вы можете себе представить, что все так дружелюбны и умны, безусловно, вернуться с большим количеством времени.",1
"кампус огромен, и если вы заинтересованы в том, чтобы путешествовать по кампусу самостоятельно, это требует очень раннего утреннего звонка пробуждения, это красивый кампус, и мой 10-летний был готов ударить по земле, бегая через час.",0
"Мы провели пешеходную экскурсию по Хахварду во главе со студентом, она была отличной, она включала в себя историю, познавательную прогулку по кампусу, экскурсия длится около 80 минут, мы многому научились и наслаждались рекомендованной экскурсией.",1
"Сколько общественных мест покидают наши садовые кресла, так что есть где-то, чтобы расслабиться с отличной атмосферой со смесью студентов Гарварда, других местных жителей и туристов, некоторые деревья для тени и просто действительно хорошее место, чтобы остыть на час или два в хороший день.",0
"Пройдя через гарвардский двор в декабре, у них есть свое собственное движение оккупантов, идущее по его отличному месту наблюдения за людьми.",0
"Мой первый визит в университет номер один в мире, и я наслаждался этим очень старым и величественным, это место, которое можно увидеть.",1
"Мы забронировали столик в этом районе, но приехали рано, поэтому мы прошлись по двору Гарварда, который готовился к их выпускному прекрасному зеленому пространству, много мест для прогулок по скульптурам, чтобы увидеть скамейки, чтобы расслабиться, мы даже видели дикого кролика.",0
"Ходил по Гарварду, и кампус был красивым и действительно аккуратным, чтобы увидеть, что у них есть красивые здания и статуи, которые определенно стоит изучить.",1
"Возьмите красную линию в Гарвард, а затем дайте себе хороший час до двух часов, чтобы поразмышлять о том, что существует так много великолепных архитектурных контрастов между древним и современным, чтобы увидеть его красивый и плоский, так удобно ходить вокруг.

Я бы предложил Google нанести на карту район и наметить маршрут от площади Гарварда до пешеходного моста через реку и обратно во двор, где вы сможете легко увидеть все достопримечательности.",0
"Что еще мы должны сказать об этом месте это лучший и самый феноменальный институт высшего образования в Соединенных Штатах и, вероятно, в мире красивые сады и прогулочные места я провел неделю, обучаясь у лучших в своей области.",1
"Как в мире вы можете серьезно относиться к уровню претенциозного отношения, источаемого этой реликвией прошлого лорда, только знает, но я даже не могу рассмотреть школу, которая буквально продает себя, покупая ваш путь в элиту так открыто, все еще взимая плату за чертовы экскурсии по кампусу?",0
"Это университетский кампус, который вы должны посетить из-за всех престижных, что Гарвард имеет вы увидите статуи и исторические здания, которые сделали его знаменитым.

Вы можете легко сесть на метро из Бостона в кембридж, есть специальная остановка в университете Гарварда, есть много магазинов подарков и ресторанов в этом районе, а также вы можете посетить районы вокруг кампуса, которые легко доступны пешком.",0
"Что еще я могу сказать о Гарварде как иностранный медицинский выпускник я был достаточно благословлен, чтобы сделать мое последипломное обучение в одной из основных учебных больниц Гарварда медицинской школы, которая имеет отличную атмосферу, но находится в Лонгвуд медицинской области в Бостоне закончил 21 год назад я вернулся, чтобы завершить программу на переговорах Гарвардской юридической школы главный кампус находится в Кэмбридже, что на самом деле другой город через реку Чарльз, я остановился в отеле Чарльза в нескольких минутах ходьбы от кампуса и площади Гарварда, что вы чувствуете энергию, но это субъективно, если вы идете в Гарвард Куп книжный магазин есть целая стена с книгами, написанными профессорами Гарвардского факультета, которые являются учебниками во многих программах по всему США и миру, что является объективным поколение знаний я горжусь тем, что учился там и достаточно скромный, чтобы применить все изученные знания и методология, чтобы продолжать приобретать знания, которые позволяют мне спасти жизни",1
"Гарвард-сквер всегда немного беспокойный, но тур стоит того, есть исторические туры, и туры по кампусу выбирают исторический тур, поэтому многие блестящие люди украшали эти земли.",1
"наслаждался студенческой экскурсией по 10 человек каждый и был показан по всей территории университета много прогулок и объяснений выпускников, которые учились здесь в прошлом.",0
"Кампус просто шикарно заполнен зелеными насаждениями и историческими зданиями, которые я посетил сам, провел более 1 часа, блуждая по кампусу, а затем площадь Гарварда отложила не менее 2 часов для посещения школы, и область вокруг нее есть так много вещей, чтобы увидеть, и вам нужно потратить время, чтобы насладиться пейзажем.",1
"Гарвардский университет стоит посетить, если вы повзрослеете, услышав так много об этой школе Лиги плюща, что очень интересно совершить экскурсию по кампусу и увидеть его лично в большом городе, окружающем его, так же, как и в каждом университетском городке Лиги плюща.",1
